Name,Scholar Link,DOI,Bibtex,PDF Name,Year,Scholar page,Journal,Downloaded,Downloaded from,Authors
,,10.3390/app12063203,False,,,,,False,,
Classification of tweets data based on polarity using improved RBF kernel of SVM,,10.1007/s41870-019-00409-4,True,10.1007%2Fs41870-019-00409-4.pdf,2020,,International Journal of Information Technology,True,SciDB,"Gopi, Arepalli Peda and Jyothi, R. Naga Sravana and Narayana, V. Lakshman and Sandeep, K. Satya"
A survey on sentiment analysis of scientific citations,,10.1007/s10462-017-9597-8,True,10.1007%2Fs10462-017-9597-8.pdf,2017,,Artificial Intelligence Review,True,SciDB,"Yousif, Abdallah and Niu, Zhendong and Tarus, John K. and Ahmad, Arshad"
In quest of new document relations: evaluating co-opinion relations between co-citations and its impact on Information retrieval effectiveness,,10.1007/s11192-019-03058-3,True,10.1007%2Fs11192-019-03058-3.pdf,2019,,Scientometrics,True,SciDB,"Yaghtin, Maryam and Sotudeh, Hajar and Mirzabeigi, Mahdieh and Fakhrahmad, Seyed Mostafa and Mohammadi, Mehdi"
Automated citation sentiment analysis using high order n-grams: a preliminary investigation,,10.3906/ELK-1712-24,True,10.3906%2FELK-1712-24.pdf,2018,,TURKISH JOURNAL OF ELECTRICAL ENGINEERING &amp; COMPUTER SCIENCES,True,SciHub,"IKRAM, Muhammad Touseef and AFZAL, Muhammad Tanvir and BUTT, Naveed Anwer"
Twitter Intention Classification Using Bayes Approach for Cricket Test Match Played Between India and South Africa 2015,,10.4018/IJRSDA.2017040104,True,,2017,,International Journal of Rough Sets and Data Analysis,False,,"Jadhav, Varsha D. and Deshmukh, Sachin N."
